{
  "$schema": "http://json-schema.org/draft-07/schema#",
  "$id": "https://jonesrussell.github.io/blog/schemas/curated-item.json",
  "title": "Curated Item",
  "description": "A content item that has passed human curation in the content pipeline.",
  "type": "object",
  "required": [
    "source", "source_ref", "content_seed", "suggested_type", "suggested_channels", "mined_at",
    "curated_type", "curated_channels", "curation_action", "curated_at"
  ],
  "additionalProperties": false,
  "properties": {
    "source": {
      "type": "string",
      "enum": ["git-commit", "github-milestone", "design-spec", "blog-post", "north-cloud"]
    },
    "source_ref": {
      "type": "string",
      "minLength": 1
    },
    "content_seed": {
      "type": "string",
      "minLength": 1
    },
    "suggested_type": {
      "type": "string",
      "enum": ["text-post", "blog-post", "video", "newsletter"]
    },
    "suggested_channels": {
      "type": "array",
      "items": {
        "type": "string",
        "enum": ["facebook", "x", "linkedin", "bluesky", "devto", "substack", "youtube"]
      },
      "minItems": 1
    },
    "mined_at": {
      "type": "string",
      "format": "date-time"
    },
    "confidence": {
      "type": "number",
      "minimum": 0,
      "maximum": 1
    },
    "curated_type": {
      "type": "string",
      "enum": ["text-post", "blog-post", "video", "newsletter"],
      "description": "Human-confirmed content type."
    },
    "curated_channels": {
      "type": "array",
      "items": {
        "type": "string",
        "enum": ["facebook", "x", "linkedin", "bluesky", "devto", "substack", "youtube"]
      },
      "minItems": 1,
      "description": "Human-confirmed distribution channels."
    },
    "curation_action": {
      "type": "string",
      "enum": ["approved", "merged", "edited"],
      "description": "What the curator decided."
    },
    "curated_at": {
      "type": "string",
      "format": "date-time",
      "description": "ISO 8601 timestamp of when curation occurred."
    },
    "merge_sources": {
      "type": "array",
      "items": { "type": "string", "minLength": 1 },
      "description": "Source refs of merged items. Only present when curation_action is 'merged'."
    },
    "editorial_notes": {
      "type": "string",
      "description": "Human notes on angle, framing, or editorial direction."
    }
  }
}
